{"apiVersion":"patroni.pgsty.com/v1alpha1","kind":"EffectiveConfiguration","metadata":{"requestId":"machine-schema-example","observedAt":"2026-07-13T12:34:56Z","warnings":[]},"data":{"target":{"context":"default","namespace":"/service","scope":"alpha","group":1,"member":"node-a"},"effective":{"example":"example"},"networkTimeouts":{"dnsLookupMilliseconds":1,"dcsDialMilliseconds":1,"dcsRequestMilliseconds":1,"patroniRequestMilliseconds":1,"postgresQueryMilliseconds":1,"postgresCloseMilliseconds":1},"sources":[{"field":"example","layer":"default","name":"node-a"}],"warnings":[{"code":"SCHEMELESS_DCS_URL","field":"example","message":"example"}]}}
